{"$schema":"https://json-schema.org/draft/2020-12/schema","$id":"https://ax9.local/contracts/stage3_vendor_fit_profile.schema.json","title":"vendor_fit_profile","type":"object","additionalProperties":false,"required":["object_type","profile_id","project_id","source_refs","signal_summary","risk_flags","confidence"],"properties":{"object_type":{"const":"vendor_fit_profile"},"profile_id":{"type":"string","minLength":1},"project_id":{"type":"string","minLength":1},"source_refs":{"type":"array","minItems":1,"items":{"type":"string","minLength":1}},"signal_summary":{"type":"string","minLength":1},"risk_flags":{"type":"array","items":{"type":"string"}},"confidence":{"type":"number","minimum":0,"maximum":1}}}
